{"objects": {}, "materials": {}, "boundaries": {"CPU": {"ID": 2, "BoundType": "Block", "IsComponent": false, "Objects": [150, 422], "ParentBndID": -1, "Block Type": "Solid", "Use External Conditions": false, "Use Total Power": true, "Total Power": "4W"}}, "general": {"object_mapping": {"12": ["Region", [80.0, 14.0, -55.0]], "10": ["Region", [-240.0, 14.0, -55.0]], "422": "CPU", "150": "KB", "178": "HEAT_SINK", "62": "MEMORY1", "90": "MEMORY1_1", "155": ["KB", [-153.6, 1.6, -102.0]], "6": "Region", "34": "SERIAL_PORT", "118": "CAPACITOR", "134": "CAPACITOR_1", "450": "ALPHA_MAIN_PCB", "498": "Box1", "554": "MeshRegion1_SubRegion", "582": "MeshRegion2_SubRegion"}}}